{
  "$schema": "https://json-schema.org/draft/2020-12/schema",
  "$id": "https://captf.io/schemas/v1alpha1/machine-inputs.json",
  "title": "CAPTF contract v1alpha1: machine role inputs",
  "description": "The rendered terraform.tfvars.json of a TerraformMachine apply (common.md, machine.md). Module inputs are exactly the contract inputs: no other properties.",
  "type": "object",
  "properties": {
    "captf_contract": { "$ref": "definitions.json#/$defs/captf_contract" },
    "captf_cluster": { "$ref": "definitions.json#/$defs/captf_cluster" },
    "captf_object": {
      "$ref": "definitions.json#/$defs/captf_object",
      "properties": { "kind": { "const": "TerraformMachine" } }
    },
    "captf_cluster_outputs": {
      "description": "The cluster role's exports output, verbatim; {} when the TerraformCluster is externally managed."
    },
    "captf_tags": {
      "$ref": "definitions.json#/$defs/captf_tags",
      "properties": { "captf.io/kind": { "const": "TerraformMachine" } }
    },
    "machine_name": {
      "description": "The owning CAPI Machine's name.",
      "type": "string",
      "minLength": 1
    },
    "bootstrap_data": {
      "description": "Base64 (standard alphabet, padded) of the bootstrap Secret's value key, always encoded (machine.md). contentEncoding is an annotation only; the pattern is the assertion.",
      "type": "string",
      "contentEncoding": "base64",
      "pattern": "^(?:[A-Za-z0-9+/]{4})*(?:[A-Za-z0-9+/]{2}==|[A-Za-z0-9+/]{3}=)?$"
    },
    "bootstrap_format": {
      "description": "The bootstrap Secret's format key; cloud-config when absent.",
      "enum": ["cloud-config", "ignition"]
    },
    "failure_domain": {
      "description": "Machine.spec.failureDomain, or null.",
      "anyOf": [{ "$ref": "definitions.json#/$defs/failure_domain_name" }, { "type": "null" }]
    },
    "kubernetes_version": {
      "description": "Machine.spec.version, verbatim (may carry a +rke2rN suffix), or null.",
      "anyOf": [{ "$ref": "definitions.json#/$defs/kubernetes_version" }, { "type": "null" }]
    },
    "control_plane": {
      "description": "True when the owning Machine carries the cluster.x-k8s.io/control-plane label.",
      "type": "boolean"
    }
  },
  "required": [
    "captf_contract",
    "captf_cluster",
    "captf_object",
    "captf_cluster_outputs",
    "captf_tags",
    "machine_name",
    "bootstrap_data",
    "bootstrap_format",
    "failure_domain",
    "kubernetes_version",
    "control_plane"
  ],
  "additionalProperties": false
}
