{
  "captf_contract": "v1alpha1",
  "captf_cluster": {
    "name": "prod",
    "namespace": "team-a"
  },
  "captf_object": {
    "kind": "TerraformMachine",
    "name": "prod-md-0-abcde",
    "namespace": "team-a"
  },
  "captf_tags": {
    "captf.io/cluster": "prod",
    "captf.io/kind": "TerraformMachine",
    "captf.io/managed-by": "captf",
    "captf.io/name": "prod-md-0-abcde",
    "captf.io/namespace": "team-a",
    "captf.io/template": ""
  },
  "captf_cluster_outputs": {
    "network_id": "net-1",
    "note": "a<b & c>d"
  },
  "machine_name": "prod-md-0-abcde-xyz12",
  "bootstrap_data": "I2Nsb3VkLWNvbmZpZwpydW5jbWQ6CiAgLSBlY2hvIDxyZWFkeT4gJiBkb25lCg==",
  "bootstrap_format": "cloud-config",
  "failure_domain": null,
  "kubernetes_version": "v1.36.2",
  "control_plane": false
}
