{
  "captf_contract": "v1alpha1",
  "captf_cluster": {
    "name": "prod",
    "namespace": "team-a"
  },
  "captf_object": {
    "kind": "TerraformMachine",
    "name": "prod-md-0-abcde",
    "namespace": "team-a"
  },
  "captf_tags": {
    "captf.io/cluster": "prod",
    "captf.io/kind": "TerraformMachine",
    "captf.io/managed-by": "captf",
    "captf.io/name": "prod-md-0-abcde",
    "captf.io/namespace": "team-a",
    "captf.io/template": "prod-md-0"
  },
  "captf_cluster_outputs": {},
  "machine_name": "prod-md-0-abcde-xyz12",
  "bootstrap_data": "e30=",
  "bootstrap_format": "ignition",
  "failure_domain": null,
  "kubernetes_version": null,
  "control_plane": false
}
